,name,rating,review,location
204,หมู่บ้านท่องเที่ยวเชิงอนุรักษ์โฮมสเตย์,5.0,1 รีวิว,"บางบาล, พระนครศรีอยุธยา"
205,วังปลาแงะ พรหมโลก,4.3,5 รีวิว,"พรหมคีรี, นครศรีธรรมราช"
206,ไร่องุ่นภูนวพันธ์,4.4,1 รีวิว,"มวกเหล็ก, สระบุรี"
207,ไร่พราวตะวัน,4.8,15 รีวิว,"ปากช่อง, นครราชสีมา"
208,อุทยานแห่งชาติพุเตย,5.0,32 รีวิว,"ด่านช้าง, สุพรรณบุรี"
209,ทุ่งหญ้าสีทอง เขาหล่น นครนายก,4.3,4 รีวิว,"เมืองนครนายก, นครนายก"
210,ละลุ,4.4,7 รีวิว,"ตาพระยา, สระแก้ว"
211,สวนละไม,4.4,8 รีวิว,"วังจันทร์, ระยอง"
212,ไร่องุ่นไวน์กราน-มอนเต้,5.0,1 รีวิว,"ปากช่อง, นครราชสีมา"
213,อุทยานแห่งชาติดอยผ้าห่มปก,5.0,3 รีวิว,"ฝาง, เชียงใหม่"
214,บึงบอระเพ็ด,4.4,1 รีวิว,"เมืองนครสวรรค์, นครสวรรค์"
215,สวนนายดำ,5.0,1 รีวิว,"ทุ่งตะโก, ชุมพร"
216,Giant’s Causeway,4.4,9 รีวิว,"Bushmills, Moyle"
217,ฟาร์มหมอปอ,,1 รีวิว,"ปากช่อง, นครราชสีมา"
218,สวนรุกขชาติเขาย้อย,,2 รีวิว,"เขาย้อย, เพชรบุรี"
219,อุทยานแห่งชาติ ภูผาม่าน,,32 รีวิว,"ชุมแพ, ขอนแก่น"
220,สวนซากุระ สถานีเกษตรหลวงอ่างขาง,,3 รีวิว,"ฝาง, เชียงใหม่"
221,แก่งกะเลา,,2 รีวิว,"นาจะหลวย, อุบลราชธานี"
222,วนอุทยานวังท่าดี,,2 รีวิว,"หนองไผ่, เพชรบูรณ์"
223,สวนอินทผาลัมโคราช,,10 รีวิว,"เมืองนครราชสีมา, นครราชสีมา"
224,ทุ่งดอกเก๊กฮวย บ้านอมลอง,,2 รีวิว,"สะเมิง, เชียงใหม่"
225,บึงสีไฟ,,7 รีวิว,"เมืองพิจิตร, พิจิตร"
226,วนอุทยานภูลังกา,,3 รีวิว,"ปง, พะเยา"
227,บ้านปลาคาร์ฟ เชียงใหม่,,1 รีวิว,"ดอยสะเก็ด, เชียงใหม่"
228,Keukenhof Garden,,5 รีวิว,"Lisse, Zuid-Holland"
229,สวนส้มเปาเปา,,3 รีวิว,"แม่ริม, เชียงใหม่"
230,เขตรักษาพันธ์ุสัตว์ป่าดอยสุเทพ,,32 รีวิว,"เมืองเชียงใหม่, เชียงใหม่"
231,อุทยานแห่งชาติรามคำแหง,,6 รีวิว,"คีรีมาศ, สุโขทัย"
232,อุทยานแห่งชาติเขาใหญ่,,20 รีวิว,"เมืองนครนายก, นครนายก"
233,ผากล้วยไม้ (ลานกางเต็นท์ ),,4 รีวิว,"ปากช่อง, นครราชสีมา"
234,สวนพฤกษศาสตร์,,14 รีวิว,"ปากช่อง, นครราชสีมา"
235,Little Big Wings : Butterfly & Garden,,8 รีวิว,"ทวีวัฒนา, กรุงเทพมหานคร"
236,อุทยานแห่งชาติทุ่งแสลงหลวง,,15 รีวิว,"วังทอง, พิษณุโลก"
237,อุทยานแห่งชาติเขาแผงม้า นครราชสีมา,,2 รีวิว,"วังน้ำเขียว, นครราชสีมา"
238,ฮาดู่บิ,,4 รีวิว,"เวียงแหง, เชียงใหม่"
239,อุทยานแห่งชาติบูโดสุไหงปาดี,,1 รีวิว,"รือเสาะ, นราธิวาส"
240,ป.ปลาปล่อย,,2 รีวิว,"ตลิ่งชัน, กรุงเทพมหานคร"
241,คุ้งบางกระเจ้า,,32 รีวิว,"พระประแดง, สมุทรปราการ"
242,วังน้ำเขียวฟาร์ม,,1 รีวิว,"วังน้ำเขียว, นครราชสีมา"
243,อุทยานแห่งชาติแม่วงก์,,3 รีวิว,"ปางศิลาทอง, กำแพงเพชร"
244,strawberry town,,1 รีวิว,"เมืองระยอง, ระยอง"
245,สะพานไม้ 100 ปี,,1 รีวิว,"ครบุรี, นครราชสีมา"
246,ทุ่งดอกหงอนนาค สวนศักดิ์สุภา,,8 รีวิว,"นาดี, ปราจีนบุรี"
247,ช่องเย็น,,7 รีวิว,"ปางศิลาทอง, กำแพงเพชร"
248,คลองน้ำใส,,4 รีวิว,"คีรีรัฐนิคม, สุราษฎร์ธานี"
249,อุทยานหินล้านปีและฟาร์มจระเข้พัทยา,,1 รีวิว,"บางละมุง, ชลบุรี"
250,ไร่ บี.เอ็น.,,2 รีวิว,"เขาค้อ, เพชรบูรณ์"
251,สวนบัวชมพู ณ จอมคีรี,,2 รีวิว,"เชียงดาว, เชียงใหม่"
252,พีบีวัลเล่ย์เขาใหญ่ไวเนอรี่,,32 รีวิว,"ปากช่อง, นครราชสีมา"
253,ทุ่งไฮเดรนเยีย โครงการหลวงขุนแปะ,,2 รีวิว,"จอมทอง, เชียงใหม่"
254,สวนส้มยอดดอย,,2 รีวิว,"แม่ริม, เชียงใหม่"
255,วนอุทยานท้าวโกษา,,7 รีวิว,"ปราณบุรี, ประจวบคีรีขันธ์"
256,หอมแผ่นดินฟาร์ม,,4 รีวิว,"แม่อาย, เชียงใหม่"
257,"Zaanse Schans, Amsterdam Netherland",,2 รีวิว,"Zaanstad, Noord-Holland"
258,อุทยานธรรมชาติวิทยาสิรีรุกขชาติ,,1 รีวิว,"พุทธมณฑล, นครปฐม"
259,สวนพฤกษศาสตร์เขาช่อง ตรัง,,8 รีวิว,"นาโยง, ตรัง"
260,อุทยานแห่งชาติอ่าวมะนาว,,3 รีวิว,"เมืองนราธิวาส, นราธิวาส"
261,อุทยานแห่งชาติดอยสุเทพ-ปุย,,1 รีวิว,"เมืองเชียงใหม่, เชียงใหม่"
262,ศูนย์การเรียนรู้ป่าวังจันทร์,,1 รีวิว,"วังจันทร์, ระยอง"
263,สวนของฉันMy garden(สวนส้ม),,32 รีวิว,"แม่ริม, เชียงใหม่"
264,อุทยานแห่งชาติภูซาง,,1 รีวิว,"ภูซาง, พะเยา"
265,วนอุทยานบัวบาน,,3 รีวิว,"เมืองหนองบัวลำภู, หนองบัวลำภู"
266,Mesa Verde National Park,,7 รีวิว,Colorado
267,Garden of the Gods,,2 รีวิว,"El Paso County, Colorado"
268,ทุ่งหนองหญ้าม้า,,4 รีวิว,"วารินชำราบ, อุบลราชธานี"
269,ทิพวรรณ รัตนพงค์,,4 รีวิว,"เมืองนครนายก, นครนายก"
270,สวนดูบัว,,5 รีวิว,"เมืองเชียงราย, เชียงราย"
271,อุทยานแห่งชาติเขาพระวิหาร,,3 รีวิว,"กันทรลักษ์, ศรีสะเกษ"
272,สวนสุภัทราแลนด์,,3 รีวิว,"บ้านค่าย, ระยอง"
273,สวนลุงรน,,8 รีวิว,"แม่ริม, เชียงใหม่"
274,Haylo,,32 รีวิว,"ทวีวัฒนา, กรุงเทพมหานคร"
275,เขตรักษาพันธุ์สัตว์ป่าห้วยขาแข้ง,,3 รีวิว,"บ้านไร่, อุทัยธานี"
276,อุทยานแห่งชาติหมู่เกาะลันตา,,3 รีวิว,"เกาะลันตา, กระบี่"
277,ล่องแพป่าต้นน้ำพะโต๊ะ,,3 รีวิว,"พะโต๊ะ, ชุมพร"
278,Bamboo Lake,,3 รีวิว,"Beitou, ไทเป"
279,ศูนย์ศึกษาการพัฒนาห้วยทรายอันเนื่องมาจากพระราชดำริ,,1 รีวิว,"ชะอำ, เพชรบุรี"
280,ไร่ปรารถนา,,4 รีวิว,"มวกเหล็ก, สระบุรี"
281,ทุ่งนามอญ,,5 รีวิว,"ลาดหลุมแก้ว, ปทุมธานี"
282,งานเชียงรายดอกไม้อาเซียน@สวนสาธารณะเกาะลอย,,1 รีวิว,"เมืองเชียงราย, เชียงราย"
283,อุทยานแห่งชาติเขาค้อ,,1 รีวิว,"เขาค้อ, เพชรบูรณ์"
284,ทะเลสาบเชียงแสน,,5 รีวิว,"เชียงแสน, เชียงราย"
285,Great Fall Park,,32 รีวิว,"Fairfax, Virginia"
286,เขตห้ามล่าสัตว์ป่าอ่างเก็บน้ำสนามบิน,,5 รีวิว,"ประโคนชัย, บุรีรัมย์"
287,Table Mountain Aerial Cableway,,4 รีวิว,"Cape Town, คาบสมุทรตะวันตก"
288,สวนหมื่นบุปผา,,1 รีวิว,"เบตง, ยะลา"
289,หน่วยจัดการต้นน้ำขุนแม่ยะ,,2 รีวิว,"ปาย, แม่ฮ่องสอน"
290,Pang Pao Beach,,1 รีวิว,"แม่แตง, เชียงใหม่"
291,Enjoy Flowers By Anon,,2 รีวิว,"ท่าม่วง, กาญจนบุรี"
292,ไร่เชษฐ์เจริญชัย กำแพงเพชร,,1 รีวิว,"ไทรงาม, กำแพงเพชร"
293,ทุ่งธรรมนา,,1 รีวิว,"สามพราน, นครปฐม"
294,สวนส้มธนาธร,,2 รีวิว,"แม่อาย, เชียงใหม่"
295,ไร่สตรอเบอรี่ปลายฟ้า,,5 รีวิว,"แม่ริม, เชียงใหม่"
296,อุทยานแห่งชาติปางสีดา สระแก้ว,,32 รีวิว,"เมืองสระแก้ว, สระแก้ว"
297,สวนดอกไม้เมืองหนาวเบตง,,2 รีวิว,"เบตง, ยะลา"
298,อุทยานแห่งชาติหาดขนอม - หมู่เกาะทะเลใต้,,2 รีวิว,"สิชล, นครศรีธรรมราช"
299,สวนลุงทองใบ,,1 รีวิว,"เมืองระยอง, ระยอง"
300,สวนสตรอเบอรีม่อนเคียงดาว,,9 รีวิว,"แม่จัน, เชียงราย"
301,อุทยานแห่งชาติศรีพังงา,,5 รีวิว,"คุระบุรี, พังงา"
302,ไร่สตรอว์เบอร์รีบ้านนอแล,,1 รีวิว,"ฝาง, เชียงใหม่"
303,โรงกาแฟ รักษ์ไทยแคมป์ ต.ชมพู วังทองพิษณุโลก,,3 รีวิว,"สวรรคโลก, สุโขทัย"
304,ก้องวัลเลย์,,2 รีวิว,"กระบุรี, ระนอง"
305,อุทยานประวัติศาสตร์ภูพระบาท,,1 รีวิว,"บ้านผือ, อุดรธานี"
306,ทุ่งทานตะวันเขาจีนแล,,3 รีวิว,"เมืองลพบุรี, ลพบุรี"
307,อุทยานแห่งชาติดอยสอยมาลัย-ไม้กลายเป็นหิน,,32 รีวิว,"บ้านตาก, ตาก"
308,เขาสันหนอกวัว,,1 รีวิว,"สังขละบุรี, กาญจนบุรี"
309,ศูนย์ศิลปาชีพบางไทร,,9 รีวิว,"บางไทร, พระนครศรีอยุธยา"
310,น้ำตกวังสายทอง,,1 รีวิว,"ทุ่งหว้า, สตูล"
311,อุทยานแห่งชาติแม่ยม,,1 รีวิว,"สอง, แพร่"
312,หน่วยพิทักษ์ป่าสบห้วยผาตั้ง - นาเลา,,2 รีวิว,"เชียงดาว, เชียงใหม่"
313,ไร่แผ่นดินทอง,,1 รีวิว,"ปากช่อง, นครราชสีมา"
314,Aiguille du Midi,,1 รีวิว,"Haute-Savoie, Auvergne-Rhône-Alpes"
315,เขตรักษาพันธุ์สัตว์ป่าภูหลวง,,1 รีวิว,"ภูเรือ, เลย"
316,โครงการหลวงตีนตก,,3 รีวิว,"แม่ออน, เชียงใหม่"
317,บีนทูบาร์ช็อคโกแล็ตฟาร์ม,,6 รีวิว,"เมืองจันทบุรี, จันทบุรี"
318,แก่งตะนะ,,32 รีวิว,"โขงเจียม, อุบลราชธานี"
319,Phuklong Hill,,4 รีวิว,"เมืองพะเยา, พะเยา"
320,ดอยสามหมื่น อุทยานแห่งชาติห้วยน้ำดัง,,1 รีวิว,"ปาย, แม่ฮ่องสอน"
321,สุพัตรา เมล่อนฟาร์ม,,1 รีวิว,"แก่งคอย, สระบุรี"
322,แม่น้ำแควใหญ่,,2 รีวิว,"เมืองกาญจนบุรี, กาญจนบุรี"
323,อุทยานปฏิบัติธรรมสมประสงค์ อยุธยา,,8 รีวิว,"บางไทร, พระนครศรีอยุธยา"
324,ศูนย์พัฒนาโครงการหลวง ม่อนเงาะ,,5 รีวิว,"แม่แตง, เชียงใหม่"
325,สวนคุณยาย,,4 รีวิว,"วังจันทร์, ระยอง"
326,สวนคุณประยูร ริเวอร์ฮิลล์,,9 รีวิว,"แกลง, ระยอง"
327,Passerelle de Bionnassay,,2 รีวิว,"Haute-Savoie, Auvergne-Rhône-Alpes"
328,ไร่สตรอเบอรีวงศ์วาน,,8 รีวิว,"สะเมิง, เชียงใหม่"
329,อุทยานแห่งชาติกุยบุรี,,32 รีวิว,"กุยบุรี, ประจวบคีรีขันธ์"
330,อุทยานนกน้ำทะเลน้อย,,1 รีวิว,"ควนขนุน, พัทลุง"
331,โครงการหลวงหนองหอย,,2 รีวิว,"แม่ริม, เชียงใหม่"
332,มหกรรมไม้ดอกอาเซียน,,5 รีวิว,"เมืองเชียงราย, เชียงราย"
333,หาดาบยาว,,1 รีวิว,"เมืองน่าน, น่าน"
334,โรงงานชา 1x2 พญาไพรเล่ามา,,2 รีวิว,"แม่ฟ้าหลวง, เชียงราย"
335,เพอคูล่าฟาร์ม,,4 รีวิว,"สัตหีบ, ชลบุรี"
336,ชนบทเขาใหญ่,,6 รีวิว,"ปากช่อง, นครราชสีมา"
337,สวนดอกไม้ลุงนพป้าปวน,,2 รีวิว,"แม่ริม, เชียงใหม่"
338,อุทยานแห่งชาติเขาปู่-เขาย่า,,1 รีวิว,"ศรีบรรพต, พัทลุง"
339,พุทธสถานจีเต็กลิ้ม,,4 รีวิว,"เมืองนครนายก, นครนายก"
340,ไร่บุญฉลวย Organic Farm จำหน่ายผลิตภัณฑ์ออร์แกนิค,,32 รีวิว,"ปากช่อง, นครราชสีมา"
341,ทุ่งสวรรค์ ปทุมเจดีย์,,5 รีวิว,"คลองหลวง, ปทุมธานี"
342,The Bloom By TV Pool,,1 รีวิว,"ปากช่อง, นครราชสีมา"
343,อุทยานแห่งชาติแม่ตะไคร้,,2 รีวิว,"ดอยสะเก็ด, เชียงใหม่"
344,เรือนกล้วยไม้ไทย,,1 รีวิว,"แม่ริม, เชียงใหม่"
345,ฟาร์มแกะทหารช่าง,,1 รีวิว,"โกรกพระ, นครสวรรค์"
346,อุทยานแห่งชาติต้นสักใหญ่,,1 รีวิว,"น้ำปาด, อุตรดิตถ์"
347,สวนรุกขชาติห้วยแก้ว,,8 รีวิว,"เมืองเชียงใหม่, เชียงใหม่"
348,Seongsan Ilchulbong Marine Provincial Park,,1 รีวิว,"Cheju, เกาะเชจู"
349,อุทยานแห่งชาติทุ่งแสลงหลวง (หนองแม่นา) เพชรบูรณ์,,2 รีวิว,"เขาค้อ, เพชรบูรณ์"
350,ถนนลอยฟ้า 1256,,3 รีวิว,"ปัว, น่าน"
351,เอเดนฟาร์ม,,32 รีวิว,"เมืองนครนายก, นครนายก"
352,Barakat Lunla Farm,,1 รีวิว,"หนองจอก, กรุงเทพมหานคร"
353,Maepim Travel / แม่พิมพ์ ทราเวล,,1 รีวิว,"แกลง, ระยอง"
354,ไร่องุ่นภูผาปัญญาสวรรค์,,1 รีวิว,"สวนผึ้ง, ราชบุรี"
355,ทุ่งซากุระภูทับเบิก,,1 รีวิว,"หล่มเก่า, เพชรบูรณ์"
356,บ้านไร่ภูตะวัน,,7 รีวิว,"ทองผาภูมิ, กาญจนบุรี"
357,ไทรงาม พิมาย,,1 รีวิว,"พิมาย, นครราชสีมา"
358,ทุ่งดอกเก๊กฮวย วังสองนคร,,1 รีวิว,"ปักธงชัย, นครราชสีมา"
359,บ่อน้ำร้อนเขาตอก,,1 รีวิว,"เคียนซา, สุราษฎร์ธานี"
360,สระมรกตกำแพงเพชร,,3 รีวิว,"เมืองกำแพงเพชร, กำแพงเพชร"
361,ทะเลใน,,1 รีวิว,"เกาะสมุย, สุราษฎร์ธานี"
362,ฟาร์มโคนมบุญชู,,32 รีวิว,"ศรีเทพ, เพชรบูรณ์"
363,สวนหลงรักไทย,,8 รีวิว,"วังทอง, พิษณุโลก"
364,อุทยานแห่งชาติน้ำพอง,,1 รีวิว,"บ้านฝาง, ขอนแก่น"
365,Poulnabrone Dolmen,,1 รีวิว,"Clare, County Clare"
366,Lake Galve,,1 รีวิว,"Trakų rajono savivaldybė, Vilniaus apskritis"
367,บ้านไร่คุณนาย,,1 รีวิว,"วังน้ำเขียว, นครราชสีมา"
368,Bai Orchid & Butterfly Farm,,1 รีวิว,"แม่ริม, เชียงใหม่"
369,ป่าสนวัดจันทร์ โครงการหลวงบ้านวัดจันทร์,,4 รีวิว,"กัลยาณิวัฒนา, เชียงใหม่"
370,อุทยานแห่งชาติออบขาน,,2 รีวิว,"หางดง, เชียงใหม่"
371,นาเกลือบ้านร่องใหญ่,,2 รีวิว,"บ้านแหลม, เพชรบุรี"
372,Organic Way City Farm,,1 รีวิว,"ราษฎร์บูรณะ, กรุงเทพมหานคร"
373,โครงการตามพระราชประสงค์ หุบกะพง,,32 รีวิว,"ชะอำ, เพชรบุรี"
374,เขตรักษาพันธ์ุสัตว์ป่าเขาเขียว,,8 รีวิว,"ศรีราชา, ชลบุรี"
375,สวนเทพพิทักษ์,,1 รีวิว,"พบพระ, ตาก"
376,สวนขวัญ ทรอปิคอล คาเฟ่ @ ขนอม,,6 รีวิว,"ขนอม, นครศรีธรรมราช"
377,ช้างป่ากุยบุรี,,4 รีวิว,"กุยบุรี, ประจวบคีรีขันธ์"
378,ตลาดชุมชนชาวไทยม้ง,,1 รีวิว,"จอมทอง, เชียงใหม่"
379,พสุธรา,,6 รีวิว,"สวนผึ้ง, ราชบุรี"
380,รังนกแลนด์,,3 รีวิว,"บางน้ำเปรี้ยว, ฉะเชิงเทรา"
381,Nai Harn Lake,,6 รีวิว,"เมืองภูเก็ต, ภูเก็ต"
382,ฟาร์มเกษตรอินทรีย์ เขาไม้แก้ว,,1 รีวิว,"กบินทร์บุรี, ปราจีนบุรี"
383,น้ำพุร้อนเค็มคลองท่อม,,3 รีวิว,"คลองท่อม, กระบี่"
384,หน่วยจัดการต้นน้ำแม่เผอะ,,32 รีวิว,"ฝาง, เชียงใหม่"
385,อุทยานศิลปวัฒนธรรมแม่ฟ้าหลวง (ไร่แม่ฟ้าหลวง),,3 รีวิว,"เมืองเชียงราย, เชียงราย"
386,อุทยานแห่งชาติน้ำตกแม่สุรินทร์,,6 รีวิว,"เมืองแม่ฮ่องสอน, แม่ฮ่องสอน"
387,เขาใหญ่ พาโนราม่า ฟาร์ม,,1 รีวิว,"ปากช่อง, นครราชสีมา"
388,อุทยานแห่งชาติศรีลานนา,,1 รีวิว,"แม่แตง, เชียงใหม่"
389,บ้านนาฟลาวเวอร์,,1 รีวิว,"แม่ริม, เชียงใหม่"
390,,,1 รีวิว,
391,,,1 รีวิว,
392,,,9 รีวิว,
393,,,1 รีวิว,
394,,,9 รีวิว,
395,,,32 รีวิว,
396,,,3 รีวิว,
397,,,5 รีวิว,
398,,,1 รีวิว,
399,,,1 รีวิว,
400,,,3 รีวิว,
401,,,1 รีวิว,
402,,,1 รีวิว,
403,,,4 รีวิว,
404,,,3 รีวิว,
405,,,16 รีวิว,
406,,,32 รีวิว,
407,,,4 รีวิว,
408,,,1 รีวิว,
409,,,4 รีวิว,
410,,,1 รีวิว,
411,,,3 รีวิว,
412,,,1 รีวิว,
413,,,1 รีวิว,
414,,,1 รีวิว,
415,,,1 รีวิว,
416,,,1 รีวิว,
417,,,32 รีวิว,
418,,,2 รีวิว,
419,,,1 รีวิว,
420,,,1 รีวิว,
421,,,4 รีวิว,
422,,,1 รีวิว,
423,,,1 รีวิว,
424,,,1 รีวิว,
425,,,7 รีวิว,
426,,,1 รีวิว,
427,,,2 รีวิว,
428,,,32 รีวิว,
